{
  "$schema": "https://json-schema.org/draft/2020-12/schema",
  "$id": "https://raw.githubusercontent.com/leonardoLoddo/hydra/main/schemas/v2/hydra.schema.json",
  "title": "Hydra project configuration",
  "description": "Shared, versioned configuration for a Hydra project. Hydra runtime validation remains authoritative.",
  "type": "object",
  "additionalProperties": false,
  "required": [
    "version",
    "projectId",
    "headsDirectory",
    "branchPrefix",
    "storage",
    "overlay"
  ],
  "properties": {
    "$schema": {
      "description": "JSON Schema used by editors for validation, completion, and field documentation. Hydra does not download it at runtime.",
      "type": "string",
      "format": "uri"
    },
    "version": {
      "description": "Hydra project-configuration format. Version 2 is the only supported version.",
      "const": 2
    },
    "projectId": {
      "description": "Opaque project identity generated by hydra init. Keep it unchanged and shared through Git.",
      "type": "string",
      "minLength": 1
    },
    "headsDirectory": {
      "description": "Portable policy used to resolve the physical directory that contains this project's Heads.",
      "oneOf": [
        {
          "$ref": "#/$defs/siblingHeadsDirectory"
        },
        {
          "$ref": "#/$defs/relativeHeadsDirectory"
        },
        {
          "$ref": "#/$defs/localHeadsDirectory"
        }
      ]
    },
    "branchPrefix": {
      "description": "Prefix prepended to every private Head branch name, for example hydra/.",
      "type": "string"
    },
    "storage": {
      "description": "Storage selection policy. Auto safely chooses copy-on-write when available and otherwise uses a full copy.",
      "$ref": "#/$defs/storage"
    },
    "overlay": {
      "description": "Rules selecting ignored project files that should be materialized inside each Head.",
      "$ref": "#/$defs/overlay"
    },
    "commands": {
      "description": "Optional trusted command adapters executed by explicit Hydra lifecycle commands.",
      "$ref": "#/$defs/commands"
    }
  },
  "$defs": {
    "siblingHeadsDirectory": {
      "title": "Sibling Heads directory",
      "description": "Places the Heads directory beside the repository by appending a filename suffix.",
      "type": "object",
      "additionalProperties": false,
      "required": [
        "strategy",
        "suffix"
      ],
      "properties": {
        "strategy": {
          "description": "Selects the sibling directory policy.",
          "const": "sibling"
        },
        "suffix": {
          "description": "Non-empty filename suffix without path separators or control characters.",
          "type": "string",
          "minLength": 1,
          "pattern": "^[^/\\\\]+$",
          "examples": [
            ".heads",
            " workspace"
          ]
        }
      }
    },
    "relativeHeadsDirectory": {
      "title": "Relative Heads directory",
      "description": "Resolves a portable path from the repository parent directory.",
      "type": "object",
      "additionalProperties": false,
      "required": [
        "strategy",
        "base",
        "path"
      ],
      "properties": {
        "strategy": {
          "description": "Selects the relative directory policy.",
          "const": "relative"
        },
        "base": {
          "description": "Anchor used to resolve the relative path.",
          "const": "repositoryParent"
        },
        "path": {
          "description": "Portable relative path containing only normal, non-empty components.",
          "type": "string",
          "minLength": 1,
          "pattern": "^(?!/)(?!.*\\\\)(?!.*//)(?!\\.\\.?$)(?!\\.\\.?/)(?!.*[/]\\.\\.?(?:/|$)).+$",
          "examples": [
            "workspaces/shop-heads"
          ]
        }
      }
    },
    "localHeadsDirectory": {
      "title": "Local Heads directory",
      "description": "Uses only the verified absolute Heads path from local, non-versioned Hydra metadata.",
      "type": "object",
      "additionalProperties": false,
      "required": [
        "strategy"
      ],
      "properties": {
        "strategy": {
          "description": "Selects the machine-local directory policy.",
          "const": "local"
        }
      }
    },
    "storage": {
      "type": "object",
      "additionalProperties": false,
      "required": [
        "mode"
      ],
      "properties": {
        "mode": {
          "description": "Selects copy-on-write when safely supported and an isolated full copy otherwise.",
          "const": "auto"
        }
      }
    },
    "overlay": {
      "type": "object",
      "additionalProperties": false,
      "required": [
        "copy"
      ],
      "properties": {
        "copy": {
          "description": "Ordered Gitignore-style rules. The directive ... .gitignore expands the project's current .gitignore at this position.",
          "type": "array",
          "items": {
            "type": "string"
          },
          "examples": [
            [
              "... .gitignore"
            ]
          ]
        }
      }
    },
    "commands": {
      "type": "object",
      "additionalProperties": false,
      "properties": {
        "open": {
          "description": "Trusted program adapter run by hydra head open after Head validation.",
          "$ref": "#/$defs/openCommand"
        }
      }
    },
    "openCommand": {
      "type": "object",
      "additionalProperties": false,
      "required": [
        "program",
        "args"
      ],
      "properties": {
        "program": {
          "description": "Executable to start without a shell. Supported placeholders: {name}, {path}, {headRef}, {baseRef}, and {targetRef}.",
          "type": "string",
          "minLength": 1,
          "examples": [
            "code"
          ]
        },
        "args": {
          "description": "Arguments passed separately to the executable. Each value may use the supported placeholders.",
          "type": "array",
          "items": {
            "type": "string"
          },
          "examples": [
            [
              "{path}"
            ]
          ]
        }
      }
    }
  }
}
